<?xml version = "1.0" ?>
<!--Copyright 2014 FSharpN00b.
This file is part of Tagger.

Tagger is free software: you can redistribute it and/or modify
it under the terms of the GNU General Public License as published by
the Free Software Foundation, either version 3 of the License, or
(at your option) any later version.

Tagger is distributed in the hope that it will be useful,
but WITHOUT ANY WARRANTY; without even the implied warranty of
MERCHANTABILITY or FITNESS FOR A PARTICULAR PURPOSE.  See the
GNU General Public License for more details.

You should have received a copy of the GNU General Public License
along with Tagger.  If not, see<http://www.gnu.org/licenses/> .

Tagger uses AvalonEdit, which is copyright 2014 AlphaSierraPapa for the SharpDevelop Team under the terms of the MIT License. For more information see www.avalonedit.net.-->

<!--This file, logconfig.xml, is set to be copied to the output directory, so the application can find it using Directory.GetCurrentDirectory.-->
<!--Note the following noNamespaceSchemaLocation value requires logconfig.xsd to be present in the output directory. We handle this as follows.
1. Add logconfig.xsd to the project.
2. In the Properties window for logconfig.xsd, set Copy to Output Directory to Copy Always.-->
<config xmlns:xsi="http://www.w3.org/2001/XMLSchema-instance" xsi:noNamespaceSchemaLocation="logconfig.xsd">
  <actions>
<!--The default append value is "Y". The default timestamp value is "yyyyMMdd HH:mm:ss".-->
    <WriteToFile name="default" file="log.txt" />    
    <MessageBox name="default" />
  </actions>
  <part name="Program">
<!--These events are critical errors.-->
<!--This version of the UnhandledException event includes the stack trace and is written to file only.-->
    <event name="UnhandledExceptionFile">
      <description>Unhandled exception.</description>
      <actions>
        <WriteToFile name="default" />
      </actions>
      <param name="shutdown" description="True if the application information was saved."/>
      <param name="message" description="The error message." />
      <param name="stack_trace" description="The stack trace."/>
<!--We do not follow an exception message with a period because the message usually includes one.-->
      <message>{timestamp} {eventname} Unhandled exception.
Application information saved: {shutdown}.
Message: {message}
Stack trace: {stack_trace}.</message>
    </event>
<!--This version of the UnhandledException event does not include the stack trace and is shown in a message box only.-->
    <event name="UnhandledExceptionAlert">
      <description>Unhandled exception.</description>
      <actions>
        <MessageBox name="default" />
      </actions>
      <param name="shutdown" description="True if the application information was saved."/>
      <param name="message" description="The error message." />
      <message>{timestamp} {eventname} Unhandled exception.
Application information saved: {shutdown}.
Message: {message}</message>
    </event>
  </part>
  <part name="Configuration">
<!--These events are non-critical errors.-->
    <event name="LoadConfigurationError">
      <description>Unable to load the configuration file.</description>
      <actions>
        <WriteToFile name="default" />
        <MessageBox name="default" />
      </actions>
      <param name="path" description="The configuration file path." />
      <param name="message" description="The error message." />
      <message>{timestamp} {eventname} Error loading configuration file: {path}. Message: {message}</message>
    </event>
    <event name="SaveConfigurationError">
      <description>Unable to save the configuration file.</description>
      <actions>
        <WriteToFile name="default" />
        <MessageBox name="default" />
      </actions>
      <param name="path" description="The configuration file path." />
      <param name="message" description="The error message." />
      <message>{timestamp} {eventname} Error saving configuration file: {path}. Message: {message}</message>
    </event>
<!--These events are informational.-->
    <event name="LoadConfiguration">
      <description>The application loaded the configuration file.</description>
      <actions>
        <WriteToFile name="default" />
      </actions>
      <param name="path" description="The configuration file path." />
      <message>{timestamp} {eventname} Loaded configuration file: {path}.</message>
    </event>
    <event name="SaveConfiguration">
      <description>The application saved the configuration file.</description>
      <actions>
        <WriteToFile name="default" />
      </actions>
      <param name="path" description="The configuration file path." />
      <message>{timestamp} {eventname} Saved configuration file: {path}.</message>
    </event>  
  </part>
  <part name="ProjectController">
<!--These events are non-critical errors.-->
    <event name="OpenProjectInformationNotFound">
      <description>The project information file was not found.</description>
      <actions>
        <WriteToFile name="default" />
      </actions>
      <param name="path" description="The project information file path." />
      <message>{timestamp} {eventname} Project information file not found: {path}.</message>
    </event>
    <event name="OpenProjectInformationError">
      <description>Unable to open the project information file.</description>
      <actions>
        <WriteToFile name="default" />
        <MessageBox name="default" />
      </actions>
      <param name="path" description="The project information file path." />
      <param name="message" description="The error message." />
      <message>{timestamp} {eventname} Error opening project information file: {path}. Message: {message}</message>
    </event>
    <event name="NewProjectCreateDirectoryError">
      <description>Unable to create the new project folder due to an error.</description>
      <actions>
        <WriteToFile name="default" />
        <MessageBox name="default" />
      </actions>
      <param name="path" description="The project folder path." />
      <param name="message" description="The error message." />
      <message>{timestamp} {eventname} Error creating new project folder: {path}. Message: {message}</message>
    </event>
    <event name="SaveProjectInformationError">
      <description>Unable to save the project information file.</description>
      <actions>
        <WriteToFile name="default" />
        <MessageBox name="default" />
      </actions>
      <param name="path" description="The project information file path." />
      <param name="message" description="The error message." />
      <message>{timestamp} {eventname} Error saving project information file: {path}. Message: {message}</message>
    </event>
<!--These events are informational.-->
    <event name="OpenProjectInformation">
      <description>The user opened a project.</description>
      <actions>
        <WriteToFile name="default" />
      </actions>
      <param name="path" description="The path of the project." />
      <message>{timestamp} {eventname} Opened project {path}.</message>
    </event>
    <event name="SaveProjectInformation">
      <description>The user saved a project.</description>
      <actions>
        <WriteToFile name="default" />
      </actions>
      <param name="path" description="The path of the project." />
      <message>{timestamp} {eventname} Saved project {path}.</message>
    </event> 
  </part>
  <part name="FileTreeViewController">
<!--These events are non-critical errors.-->
    <event name="OpenProjectFolderNotFound">
      <description>The project folder was not found.</description>
      <actions>
        <WriteToFile name="default" />
        <MessageBox name="default" />
      </actions>
      <param name="path" description="The project folder path." />
      <message>{timestamp} {eventname} Project folder not found: {path}.</message>
    </event>
    <event name="NewFileCreateDirectoryError">
      <description>The directory to which the new file was to be added does not exist, and we were unable to create it.</description>
      <actions>
        <WriteToFile name="default" />
        <MessageBox name="default" />
      </actions>
      <param name="path" description="The directory to which the new file was to be added." />
      <param name="message" description="The error message." />
      <message>{timestamp} {eventname} Error adding new file to directory: {path}. Directory does not exist and we were unable to create it. Message: {message}</message>
    </event>
    <event name="NewFileCreateFileError">
      <description>Unable to create new file.</description>
      <actions>
        <WriteToFile name="default" />
        <MessageBox name="default" />
      </actions>
      <param name="path" description="The path of the new file." />
      <param name="message" description="The error message." />
      <message>{timestamp} {eventname} Error creating new file: {path}. Message: {message}</message>
    </event>
    <event name="NewFolderCreateDirectoryError">
      <description>Unable to create new folder.</description>
      <actions>
        <WriteToFile name="default" />
        <MessageBox name="default" />
      </actions>
      <param name="path" description="The path of the new folder." />
      <param name="message" description="The error message." />
      <message>{timestamp} {eventname} Error creating new folder: {path}. Message: {message}</message>
    </event>
    <event name="RenameFileIOError">
      <description>Unable to rename file, possibly because the file is in use by another process.</description>
      <actions>
        <WriteToFile name="default" />
        <MessageBox name="default" />
      </actions>
      <param name="path" description="The path of the file." />
      <param name="name" description="The proposed new name for the file." />
      <param name="message" description="The error message." />